<?xml version="1.0" encoding="UTF-8"?>
<!--
<!DOCTYPE lexicon  PUBLIC '-//XMLmind//DTD lexicon//FI'  '../../dtd/questions.dtd'>
-->

<questions>
  <q id="derav1">
    <qtype>A-DER-V</qtype>
   <question>
      <text>Mo manná PERS</text>
      <element id="PERS">
	<grammar tag="N+Prop+Sg+Com"/>
	<sem class="mPERSNAME"/>
      </element>
    </question>
    <answer> 
      <text>Son lea maŋimuš áigge VERB</text>
      <element game='morfa' id="VERB" task="yes" >
	<sem class="mOLBMO_V"/>
	<grammar tag="A+Der/AV+V+PrfPrc"/>
      </element>
    </answer>
  </q> 
  <q id="derav2">
    <qtype>A-DER-V</qtype>
   <question>
      <text>Mo manai PERS doppe</text>
      <element id="PERS">
	<grammar tag="N+Prop+Sg+Com"/>
	<sem class="mPERSNAME"/>
      </element>
    </question>
    <answer> 
      <text>Son duođaid VERB</text>
      <element game='morfa' id="VERB" task="yes" >
	<sem class="mOLBMO_V"/>
	<grammar tag="A+Der/AV+V+Ind+Prt+Sg3"/>
      </element>
    </answer>
  </q> 
  <q id="derav3">
    <qtype>A-DER-V</qtype>
   <question>
      <text>Mo dus manai PLACE</text>
      <element id="PLACE">
	<grammar tag="N+Prop+Sg+Loc"/>
	<sem class="mPLACENAME"/>
      </element>
    </question>
    <answer> 
      <text>Mun duođaid VERB doppe</text>
      <element game='morfa' id="VERB" task="yes" >
	<sem class="mOLBMO_V"/>
	<grammar tag="A+Der/AV+V+Ind+Prt+Sg1"/>
      </element>
    </answer>
  </q> 
  <q id="derav4">
    <qtype>A-DER-V</qtype>
   <question>
      <text>Mo lei dalle go bohtet ruoktot</text>
    </question>
    <answer> 
      <text>Dalle lei VERB</text>
      <element game='morfa' id="VERB" task="yes" >
	<sem class="mWEATHER_V"/>
	<grammar tag="A+Der/AV+V+PrfPrc"/>
      </element>
    </answer>
    <answer> 
      <text>VERB ovdalgo mun bohten</text>
      <element game='morfa' id="VERB" task="yes" >
	<sem class="mWEATHER_V"/>
	<grammar tag="A+Der/AV+V+Ind+Prt+Sg3"/>
      </element>
    </answer>
  </q> 
  <q id="derav5">
    <qtype>A-DER-V</qtype>
   <question>
      <text>Suitet go oastit dien biilla</text>
    </question>
    <answer> 
      <text>In dieđe vuos, oainnán ahte lea VERB</text>
      <element game='morfa' id="VERB" task="yes" >
	<sem class="mBIILA_V"/>
	<grammar tag="A+Der/AV+V+PrfPrc"/>
      </element>
    </answer>
  </q> 
  <q id="derav6">
    <qtype>A-DER-V</qtype>
   <question>
      <text>Ledje go buorit heajat</text>
    </question>
    <answer> 
      <text>Ledje, muhto mun nu VERB</text>
      <element game='morfa' id="VERB" task="yes" >
	<sem class="mFEASTA_V"/>
	<grammar tag="A+Der/AV+V+Ind+Prt+Sg1"/>
      </element>
    </answer>
  </q> 
  <q id="derav7">
    <qtype>A-DER-V</qtype>
   <question>
      <text>Manne don háliidat molsut buvssaid</text>
    </question>
    <answer> 
      <text>Mu buvssat leat VERB</text>
      <element game='morfa' id="VERB" task="yes" >
	<sem class="mBAIDI_V"/>
	<grammar tag="A+Der/AV+V+PrfPrc"/>
      </element>
    </answer>
    <answer> 
      <text>Mu buvssat VERB</text>
      <element game='morfa' id="VERB" task="yes" >
	<sem class="mBAIDI_V"/>
	<grammar tag="A+Der/AV+V+Ind+Prt+Pl3"/>
      </element>
    </answer>
  </q> 
  <q id="derav8">
    <qtype>A-DER-V</qtype>
   <question>
      <text>Mii dáhpáhuvai du čáppa gáktái</text>
    </question>
    <answer> 
      <text>Mu gákti VERB</text>
      <element game='morfa' id="VERB" task="yes" >
	<sem class="mBAIDI_V"/>
	<grammar tag="A+Der/AV+V+Ind+Prt+Sg3"/>
      </element>
    </answer>
  </q> 
  <q id="derav9">
    <qtype>A-DER-V</qtype>
   <question>
      <text>Mo manai mánáin riegádanfeasttas</text>
    </question>
    <answer> 
      <text>Bures, muhto sii nu VERB</text>
      <element game='morfa' id="VERB" task="yes" >
	<sem class="mFEASTA_V"/>
	<grammar tag="A+Der/AV+V+Ind+Prt+Pl3"/>
      </element>
    </answer>
  </q> 
  <q id="derav10">
    <qtype>A-DER-V</qtype>
   <question>
      <text>Mii lea dáhpáhuvvan du čáppa gáktái</text>
    </question>
    <answer> 
      <text>Mu gákti lea VERB</text>
      <element game='morfa' id="VERB" task="yes" >
	<sem class="mBAIDI_V"/>
	<grammar tag="A+Der/AV+V+PrfPrc"/>
      </element>
    </answer>
  </q> 
  <q id="dervv1">
    <qtype>DER-PASSV</qtype>
   <question>
      <text>Áiggut go oastit dien ITEM</text>
      <element id="ITEM">
	<sem class="CLOTHING"/>
	<grammar tag="N+Nountype+Sg+Acc"/>
      </element>
    </question>
    <answer> 
      <text>In áiggo, dat VERB juo ikte</text>
      <element game='morfa' id="VERB" task="yes" >
	<id>vuovdit</id>
	<grammar tag="V+Der/PassL+V+Ind+Prt+Sg3"/>
      </element>
    </answer>
  </q> 
  <q id="dervv2">
    <qtype>DER-PASSV</qtype>
   <question>
      <text>Áiggut go oastit dien ITEM</text>
      <element id="ITEM">
	<sem class="mPRIVVEHICLE"/>
	<grammar tag="N+Nountype+Sg+Acc"/>
      </element>
    </question>
    <answer> 
      <text>In áiggo, dat VERB juo ikte</text>
      <element game='morfa' id="VERB" task="yes" >
	<id>vuovdit</id>
	<grammar tag="V+Der/PassL+V+Ind+Prt+Sg3"/>
      </element>
    </answer>
  </q> 
  <q id="dervv3">
    <qtype>DER-PASSV</qtype>
   <question>
      <text>Goas áiggut divvut ITEM</text>
      <element id="ITEM">
	<sem class="mPRIVVEHICLE"/>
	<grammar tag="N+Nountype+Sg+Acc"/>
      </element>
    </question>
    <answer> 
      <text>Dat VERB juo ikte</text>
      <element game='morfa' id="VERB" task="yes" >
	<id>divvut</id>
	<grammar tag="V+Der/PassL+V+Ind+Prt+Sg3"/>
      </element>
    </answer>
  </q> 
  <q id="dervv4">
    <qtype>DER-PASSV</qtype>
   <question>
      <text>Lea go dus ruhta máksit ITEM</text>
      <element id="ITEM">
	<sem class="mPRIVVEHICLE"/>
	<grammar tag="N+Nountype+Sg+Acc"/>
      </element>
    </question>
    <answer> 
      <text>ITEM lea juo VERB</text>
      <element id="ITEM" content="ITEM">
	<grammar tag="N+Nountype+Sg+Nom"/>
      </element>
      <element game='morfa' id="VERB" task="yes" >
	<id>máksit</id>
	<grammar tag="V+Der/PassL+V+PrfPrc"/>
      </element>
    </answer>
  </q> 
  <q id="dervv5">
    <qtype>DER-PASSV</qtype>
   <question>
      <text>Mii dáhpáhuvai biergguin</text>
    </question>
    <answer> 
      <text>Biergu lea VERB</text>
      <element game='morfa' id="VERB" task="yes" >
	<id>borrat</id>
	<grammar tag="V+Der/PassL+V+PrfPrc"/>
      </element>
    </answer>
    <answer> 
      <text>Biergu lea juo VERB</text>
      <element game='morfa' id="VERB" task="yes" >
	<sem class="mCOOK"/>
	<grammar tag="V+Der/PassL+V+PrfPrc"/>
      </element>
    </answer>
    <answer> 
      <text>Buot biergu VERB</text>
      <element game='morfa' id="VERB" task="yes" >
	<sem class="mCOOK"/>
	<grammar tag="V+Der/PassL+V+Ind+Prt+Sg3"/>
      </element>
    </answer>
    <answer> 
      <text>Biergu lea VERB niestin</text>
      <element game='morfa' id="VERB" task="yes" >
	<id>geavahit</id>
	<grammar tag="V+Der/PassL+V+PrfPrc"/>
      </element>
    </answer>
    <answer> 
      <text>Biergu lea VERB niestin</text>
      <element game='morfa' id="VERB" task="yes" >
	<id>atnit</id>
	<grammar tag="V+Der/PassL+V+PrfPrc"/>
      </element>
    </answer>
  </q> 
  <q id="dervv6">
    <qtype>DER-PASSV</qtype>
   <question>
      <text>Man boarrásat duot viesut leat</text>
    </question>
    <answer> 
      <text>Dat VERB 50-logus</text>
      <element game='morfa' id="VERB" task="yes" >
	<id>hukset</id>
	<grammar tag="V+Der/PassL+V+Ind+Prt+Pl3"/>
      </element>
    </answer>
  </q> 
  <q id="dervv7">
    <qtype>DER-PASSV</qtype>
   <question>
      <text>Man boarrásat ITEM leat</text>
      <element id="ITEM">
	<sem class="mPRINTEDMATTER"/>
	<grammar tag="N+Nountype+Pl+Nom"/>
      </element>
    </question>
    <answer> 
      <text>Dat VERB soađi áigge</text>
      <element game='morfa' id="VERB" task="yes" >
	<id>čállit</id>
	<grammar tag="V+Der/PassL+V+Ind+Prt+Pl3"/>
      </element>
    </answer>
    <answer> 
      <text>Dat VERB moadde jagi dás ovdal</text>
      <element game='morfa' id="VERB" task="yes" >
	<id>almmuhit</id>
	<grammar tag="V+Der/PassL+V+Ind+Prt+Pl3"/>
      </element>
    </answer>
  </q> 
  <q id="dervv8">
    <qtype>DER-PASSV</qtype>
   <question>
      <text>Manne oasttát nu ollu ITEM</text>
      <element id="ITEM">
	<sem class="mPRINTEDMATTER"/>
	<grammar tag="N+Nountype+Pl+Acc"/>
      </element>
    </question>
    <answer> 
      <text>Dat VERB oahpahussii</text>
      <element game='morfa' id="VERB" task="yes" >
	<id>dárbbašit</id>
	<grammar tag="V+Der/PassL+V+Ind+Prs+Pl3"/>
      </element>
    </answer>
    <answer> 
      <text>Dat VERB oahpahusas</text>
      <element game='morfa' id="VERB" task="yes" >
	<id>geavahit</id>
	<grammar tag="V+Der/PassL+V+Ind+Prs+Pl3"/>
      </element>
    </answer>
    <answer> 
      <text>Dat VERB oahpahusas</text>
      <element game='morfa' id="VERB" task="yes" >
	<id>atnit</id>
	<grammar tag="V+Der/PassL+V+Ind+Prs+Pl3"/>
      </element>
    </answer>
  </q> 
  <q id="dervv9">
    <qtype>DER-PASSV</qtype>
   <question>
      <text>Dat han lea fiinna ITEM</text>
      <element id="ITEM">
	<sem class="BUILDING"/>
	<grammar tag="N+Nountype+Sg+Nom"/>
      </element>
    </question>
    <answer> 
      <text>Dat VERB diibmá</text>
      <element game='morfa' id="VERB" task="yes" >
	<sem class="mBUILD"/>
	<grammar tag="V+Der/PassL+V+Ind+Prt+Pl3"/>
      </element>
    </answer>
    <answer> 
      <text>Dat leage aiddo VERB</text>
      <element game='morfa' id="VERB" task="yes" >
	<sem class="mBUILD"/>
	<grammar tag="V+Der/PassL+V+PrfPrc"/>
      </element>
    </answer>
  </q> 
  <q id="dervv10">
    <qtype>DER-PASSV</qtype>
   <question>
      <text>Goas eadni oažžu ođđa stuolut</text>
    </question>
    <answer> 
      <text>Dat VERB gaskavahku</text>
      <element game='morfa' id="VERB" task="yes" >
	<id>viežžat</id>
	<grammar tag="V+Der/PassL+V+Ind+Prs+Pl3"/>
      </element>
    </answer>
    <answer> 
      <text>Dat VERB ihttin</text>
      <element game='morfa' id="VERB" task="yes" >
	<id>buktit</id>